{
  "manifestVersion": 1,
  "packageVersion": "0.2.1",
  "policySchemaVersion": "1.0",
  "policyEngineVersion": "1.0.4",
  "policyEngineFingerprint": "sha256:fc01eed19014b378a76413c5e93d3c4d2af37e92cbcae2602a75f55b353bc91b",
  "artifactCount": 101,
  "departmentCount": 16,
  "workflowCount": 16,
  "artifacts": [
    {
      "path": "catalog.json",
      "kind": "catalog",
      "bytes": 40148,
      "sha256": "sha256:d8e12123412007b05b6afb85e9daf7a12fa1782ada0df6defc9cfe690054d6f5"
    },
    {
      "path": "contract-registry.json",
      "kind": "contract-registry",
      "bytes": 1761,
      "sha256": "sha256:37b7e2bbf982f2edd12b6a67e647a943687fd5843b7e11dc59ab94096e992cc4"
    },
    {
      "path": "docs/catalog.md",
      "kind": "catalog-documentation",
      "bytes": 3938,
      "sha256": "sha256:b5fa0a972b0eddb554a96f39969a90e946a49e2e1ba03e9d4e1329a5670c1e9a"
    },
    {
      "path": "openapi.json",
      "kind": "api-contract",
      "bytes": 260469,
      "sha256": "sha256:60d32cc2ec317f9df9cb6e2b8da25e5986e77fe48eec0b72f5d0fd62465cd14f"
    },
    {
      "path": "policy-lifecycle.json",
      "kind": "policy-lifecycle",
      "bytes": 5281,
      "sha256": "sha256:23dd160ac9014262fa078fda1edd9865465f43c489da65d68680fab79f61a6ea"
    },
    {
      "path": "policy-lock.json",
      "kind": "policy-lock",
      "bytes": 3736,
      "sha256": "sha256:a68192bc2289a3b1c962d88a2ac5e7621c7e4d7861d53cd12b35137390156300"
    },
    {
      "path": "policy-snapshot.json",
      "kind": "policy-snapshot",
      "bytes": 52728,
      "sha256": "sha256:c5f12e55b2300dddb71103c61cca4f8f088dc13ae07ac03150cb7bf352b96a0b"
    },
    {
      "path": "runtime-compatibility.json",
      "kind": "runtime-compatibility",
      "bytes": 547,
      "sha256": "sha256:646d97edd2b678722ab62d98a8639070422df87ffdefe2c2a94e155c90e5b374"
    },
    {
      "path": "schemas/artifact-manifest.schema.json",
      "kind": "json-schema",
      "bytes": 2329,
      "sha256": "sha256:6d9fa6b2c3901c2d0793d7e21b74ee75789c910ac45a4a4450f9e7cc61c2c06e"
    },
    {
      "path": "schemas/bundle-manifest.schema.json",
      "kind": "json-schema",
      "bytes": 2200,
      "sha256": "sha256:e6f0b56b3d623f54b69fd85e85ac1557914c39e18845b5e65d280b0817a088b6"
    },
    {
      "path": "schemas/catalog.schema.json",
      "kind": "json-schema",
      "bytes": 4789,
      "sha256": "sha256:17c23330a35557f46d0dbcf0ca71a4bf48112a3351952d974302778810bb9160"
    },
    {
      "path": "schemas/conformance-comparison.schema.json",
      "kind": "json-schema",
      "bytes": 5989,
      "sha256": "sha256:0f42c71607d94972ace8ab545ab31aeca13843ce393a209e31ba68232de71ce8"
    },
    {
      "path": "schemas/conformance-report.schema.json",
      "kind": "json-schema",
      "bytes": 6932,
      "sha256": "sha256:f426cdbd9e92092fdae674ee6b5daf8ee5dc50addd91f49cb3f39d6ef2583664"
    },
    {
      "path": "schemas/contract-registry.schema.json",
      "kind": "json-schema",
      "bytes": 1463,
      "sha256": "sha256:aa3a7ba5e312e3bcf6a08a72fd22f59f9b9459d848c0567b30e5ad07a2fc91a2"
    },
    {
      "path": "schemas/field-mapping.schema.json",
      "kind": "json-schema",
      "bytes": 1203,
      "sha256": "sha256:f27579945547f28b9b6d03e57a0d3ffe50427f0d3df97dee1f851ee95a3a6d1a"
    },
    {
      "path": "schemas/policy-lifecycle.schema.json",
      "kind": "json-schema",
      "bytes": 2100,
      "sha256": "sha256:a050a04d658cf1a37dedf72dcc859dac352b555efb804427eff55345b109cc74"
    },
    {
      "path": "schemas/policy-lock.schema.json",
      "kind": "json-schema",
      "bytes": 1473,
      "sha256": "sha256:bfd31c6b7fcb8e5d0c3c91273e016b60348ea4e874fea149ac5aedfa7ed2e9a1"
    },
    {
      "path": "schemas/policy-snapshot.schema.json",
      "kind": "json-schema",
      "bytes": 5783,
      "sha256": "sha256:67cf01c6b3e1bb8054cb98713fec548f0620b0987d5cbe7d21cce6729a00bc4d"
    },
    {
      "path": "schemas/readiness-report.schema.json",
      "kind": "json-schema",
      "bytes": 5872,
      "sha256": "sha256:d2e46bc6f65ecd9d18d91fbe66dffc316517bce14a989810b7c4cd3c6baa6b94"
    },
    {
      "path": "schemas/release-manifest.schema.json",
      "kind": "json-schema",
      "bytes": 1623,
      "sha256": "sha256:ef59ac6a2184704cd3210c4ae627cf33c7b396ce5835ef0f9c99929460600fd6"
    },
    {
      "path": "schemas/runtime-compatibility.schema.json",
      "kind": "json-schema",
      "bytes": 1854,
      "sha256": "sha256:9d49a9ce40721fc6a49cecb0d75c42e30ab487942e98d17f50432210069956cb"
    },
    {
      "path": "workflows/corporate-communications/external-communication-approval/README.md",
      "kind": "workflow-documentation",
      "department": "corporate-communications",
      "workflow": "external-communication-approval",
      "bytes": 5496,
      "sha256": "sha256:66c395432e9992cb40b6457a9588f2e68531c0bafca1430106a55381c31ff714"
    },
    {
      "path": "workflows/corporate-communications/external-communication-approval/examples/high-risk.json",
      "kind": "fixture-high-risk",
      "department": "corporate-communications",
      "workflow": "external-communication-approval",
      "bytes": 302,
      "sha256": "sha256:95ab53beeaca65aef79c52ef80b68bc81b56320f2fcad3609e51d4bfb1111ee5"
    },
    {
      "path": "workflows/corporate-communications/external-communication-approval/examples/invalid.json",
      "kind": "fixture-invalid",
      "department": "corporate-communications",
      "workflow": "external-communication-approval",
      "bytes": 115,
      "sha256": "sha256:3819f9d4f39bbf0adf033feadc95e708316a44fc0be7a3784ccf25fb7a31eff6"
    },
    {
      "path": "workflows/corporate-communications/external-communication-approval/examples/low-risk.json",
      "kind": "fixture-low-risk",
      "department": "corporate-communications",
      "workflow": "external-communication-approval",
      "bytes": 303,
      "sha256": "sha256:104c4d321c2f0406d1b47ffda5a5398edb2d8c47793ccc3aa8e835a394a077ce"
    },
    {
      "path": "workflows/corporate-communications/external-communication-approval/workflow.json",
      "kind": "workflow",
      "department": "corporate-communications",
      "workflow": "external-communication-approval",
      "bytes": 16160,
      "sha256": "sha256:61889c960fb9f52f65d278e85491d1ba84ebc091aa2b4bc275993948453f13d1"
    },
    {
      "path": "workflows/customer-success/customer-risk-escalation/README.md",
      "kind": "workflow-documentation",
      "department": "customer-success",
      "workflow": "customer-risk-escalation",
      "bytes": 5395,
      "sha256": "sha256:cb888bcb83c172a8edd708c4cabd92576f560b945472d8e4ba760006a391ee44"
    },
    {
      "path": "workflows/customer-success/customer-risk-escalation/examples/high-risk.json",
      "kind": "fixture-high-risk",
      "department": "customer-success",
      "workflow": "customer-risk-escalation",
      "bytes": 237,
      "sha256": "sha256:778bac4a71a6dec4946a508d98fcefae9b5fe1256ee8a6f9da981e2a9869b263"
    },
    {
      "path": "workflows/customer-success/customer-risk-escalation/examples/invalid.json",
      "kind": "fixture-invalid",
      "department": "customer-success",
      "workflow": "customer-risk-escalation",
      "bytes": 56,
      "sha256": "sha256:ab6fd472e0e51fcb78689b521b1f2515832a6ca269b55dcf5c269718d32d0db9"
    },
    {
      "path": "workflows/customer-success/customer-risk-escalation/examples/low-risk.json",
      "kind": "fixture-low-risk",
      "department": "customer-success",
      "workflow": "customer-risk-escalation",
      "bytes": 240,
      "sha256": "sha256:81b69c98af0e776c6520405195d46d960a8ef3583fbe55ae486180f61f6eff08"
    },
    {
      "path": "workflows/customer-success/customer-risk-escalation/workflow.json",
      "kind": "workflow",
      "department": "customer-success",
      "workflow": "customer-risk-escalation",
      "bytes": 16059,
      "sha256": "sha256:ebcdc0f7c7d821e41ba5a19189f55a2a67534f47513308e81cacb047a5016b65"
    },
    {
      "path": "workflows/data-and-analytics/data-access-request-triage/README.md",
      "kind": "workflow-documentation",
      "department": "data-and-analytics",
      "workflow": "data-access-request-triage",
      "bytes": 5412,
      "sha256": "sha256:1df54144d556f28a69425ce2aafd3bd692131c7ba544635cc84add3b8a9fd748"
    },
    {
      "path": "workflows/data-and-analytics/data-access-request-triage/examples/high-risk.json",
      "kind": "fixture-high-risk",
      "department": "data-and-analytics",
      "workflow": "data-access-request-triage",
      "bytes": 263,
      "sha256": "sha256:ac617b8037df842bfb3e2e7981124a175c1fcbdec3bde3d5d97a8368f4c348e6"
    },
    {
      "path": "workflows/data-and-analytics/data-access-request-triage/examples/invalid.json",
      "kind": "fixture-invalid",
      "department": "data-and-analytics",
      "workflow": "data-access-request-triage",
      "bytes": 80,
      "sha256": "sha256:03a60d25d3715e03ed3b019f783551961a30a46c646921bb2549550748a8565d"
    },
    {
      "path": "workflows/data-and-analytics/data-access-request-triage/examples/low-risk.json",
      "kind": "fixture-low-risk",
      "department": "data-and-analytics",
      "workflow": "data-access-request-triage",
      "bytes": 265,
      "sha256": "sha256:648cc256e91d915537d226625a9d63166b77eac094d97d0aae669ac9bbb20aaa"
    },
    {
      "path": "workflows/data-and-analytics/data-access-request-triage/workflow.json",
      "kind": "workflow",
      "department": "data-and-analytics",
      "workflow": "data-access-request-triage",
      "bytes": 15997,
      "sha256": "sha256:d4eddb05d972d72ee63555a901aae055bd3500322b67af426eef098169ba1767"
    },
    {
      "path": "workflows/engineering/production-change-risk-gate/README.md",
      "kind": "workflow-documentation",
      "department": "engineering",
      "workflow": "production-change-risk-gate",
      "bytes": 5398,